"title","description","price","count"
"Orchids","Perfect white orchid flowers","17","24"
"Hydrangeas","Gentle bouquet of hydrangeas is indescribably beautiful","45","7"
"Alstroemerias","Particoloured alstromeries","22","19"
"Pink roses","Beautiful bouquet of pink roses","18","56"
"Red roses","Beautiful bouquet of red roses","18","44"
"White roses","Beautiful bouquet of white roses","12","105"
"Pink gerberas","Modern and stylish bouquet of pink gerberas","37","81"
"White camomile chrysanthemums","Original bouquet of white camomile chrysanthemums","28","9"